,created_at,updated_at,title,address,city_code,location,neighborhood,categories,ranking.level,ranking.has_video,ranking.views,ranking.notifications,severity,_geoloc,updates,objectID,_highlightResult
115,1646810260000,1646814197000,Armed Carjacking Suspect in Custody Following Crash,"5000 W Jackson Blvd, Chicago, Illinois, 60644",us-il-chicago,5000 W Jackson Blvd,Chicago,['Weapon'],2,False,0,0,red,"[{'lat': 41.87700201378996, 'lng': -87.7494779824044}]","[{'created_at': 1646810259999, 'text': 'Incident reported at 5000 W Jackson Blvd.'}, {'created_at': 1646810260000, 'text': 'Police at the scene advised that a carjacked vehicle crashed and the offender fled the scene on foot from the north alley toward southbound from West Jackson Blvd on the yard.'}, {'created_at': 1646810432000, 'text': 'Police on the scene have located the abandoned vehicle at 5032 West Jackson Blvd.'}, {'created_at': 1646810475000, 'text': 'Officers advise that Illinois State police have the suspect in custody.'}, {'created_at': 1646810695000, 'text': 'Police request EMS for a person who may have been injured following the collision.'}, {'created_at': 1646810755000, 'text': 'Police updated that the vehicle was taken at gunpoint from 605 West 35th street.'}, {'created_at': 1646810877000, 'text': 'Police reported that one offender is still at large.'}, {'created_at': 1646811337000, 'text': 'The vehicle taken is said to be a Silver Murano with license plate CQ37057.'}, {'created_at': 1646811548000, 'text': 'Police updated that the vehicle taken was a blue Nissan Sentra with license plate CQ37057 and not a silver Murano as earlier reported.'}]",-MxhXaSUl3zDeqW104zQ,"{'created_at': {'value': '1646810260000', 'matchLevel': 'none', 'matchedWords': []}, 'updated_at': {'value': '1646814197000', 'matchLevel': 'none', 'matchedWords': []}, 'title': {'value': 'Armed Carjacking Suspect in Custody Following Crash', 'matchLevel': 'none', 'matchedWords': []}, 'address': {'value': '5000 W Jackson Blvd, Chicago, Illinois, 60644', 'matchLevel': 'none', 'matchedWords': []}, 'city_code': {'value': 'us-il-chicago', 'matchLevel': 'none', 'matchedWords': []}, 'location': {'value': '5000 W Jackson Blvd', 'matchLevel': 'none', 'matchedWords': []}, 'neighborhood': {'value': 'Chicago', 'matchLevel': 'none', 'matchedWords': []}, 'categories': [{'value': '<em>Weapon</em>', 'matchLevel': 'full', 'fullyHighlighted': True, 'matchedWords': ['weapon']}], 'ranking.level': {'value': '2', 'matchLevel': 'none', 'matchedWords': []}, 'ranking.views': {'value': '0', 'matchLevel': 'none', 'matchedWords': []}, 'ranking.notifications': {'value': '0', 'matchLevel': 'none', 'matchedWords': []}, 'severity': {'value': 'red', 'matchLevel': 'none', 'matchedWords': []}, '_geoloc': [{'lat': {'value': '41.87700201378996', 'matchLevel': 'none', 'matchedWords': []}, 'lng': {'value': '-87.7494779824044', 'matchLevel': 'none', 'matchedWords': []}}], 'updates': [{'created_at': {'value': '1646810259999', 'matchLevel': 'none', 'matchedWords': []}, 'text': {'value': 'Incident reported at 5000 W Jackson Blvd.', 'matchLevel': 'none', 'matchedWords': []}}, {'created_at': {'value': '1646810260000', 'matchLevel': 'none', 'matchedWords': []}, 'text': {'value': 'Police at the scene advised that a carjacked vehicle crashed and the offender fled the scene on foot from the north alley toward southbound from West Jackson Blvd on the yard.', 'matchLevel': 'none', 'matchedWords': []}}, {'created_at': {'value': '1646810432000', 'matchLevel': 'none', 'matchedWords': []}, 'text': {'value': 'Police on the scene have located the abandoned vehicle at 5032 West Jackson Blvd.', 'matchLevel': 'none', 'matchedWords': []}}, {'created_at': {'value': '1646810475000', 'matchLevel': 'none', 'matchedWords': []}, 'text': {'value': 'Officers advise that Illinois State police have the suspect in custody.', 'matchLevel': 'none', 'matchedWords': []}}, {'created_at': {'value': '1646810695000', 'matchLevel': 'none', 'matchedWords': []}, 'text': {'value': 'Police request EMS for a person who may have been injured following the collision.', 'matchLevel': 'none', 'matchedWords': []}}, {'created_at': {'value': '1646810755000', 'matchLevel': 'none', 'matchedWords': []}, 'text': {'value': 'Police updated that the vehicle was taken at gunpoint from 605 West 35th street.', 'matchLevel': 'none', 'matchedWords': []}}, {'created_at': {'value': '1646810877000', 'matchLevel': 'none', 'matchedWords': []}, 'text': {'value': 'Police reported that one offender is still at large.', 'matchLevel': 'none', 'matchedWords': []}}, {'created_at': {'value': '1646811337000', 'matchLevel': 'none', 'matchedWords': []}, 'text': {'value': 'The vehicle taken is said to be a Silver Murano with license plate CQ37057.', 'matchLevel': 'none', 'matchedWords': []}}, {'created_at': {'value': '1646811548000', 'matchLevel': 'none', 'matchedWords': []}, 'text': {'value': 'Police updated that the vehicle taken was a blue Nissan Sentra with license plate CQ37057 and not a silver Murano as earlier reported.', 'matchLevel': 'none', 'matchedWords': []}}]}"
116,1646809856000,1646810013000,Search for Armed Person in Stolen Vehicle,"N Lake Shore Dr & E Erie St, Chicago, Illinois, 60611",us-il-chicago,N Lake Shore Dr & E Erie St,"River North, Chicago",['Weapon'],1,False,0,0,yellow,"[{'lat': 41.89427003352637, 'lng': -87.61535990406543}]","[{'created_at': 1646809855999, 'text': 'Incident reported at N Lake Shore Dr & E Erie St.'}, {'created_at': 1646809856000, 'text': 'Police are searching for a person who may be armed inside a vehicle who was last seen south along North Lake Shore Drive.'}, {'created_at': 1646809877000, 'text': 'Police updated that this person may be the same one wanted for an armed robbery.'}, {'created_at': 1646810012000, 'text': 'Police updated that the person is inside a white Nissan with license plate AM63468 which was stolen during a crajacking.'}]",-MxhW33i4c-w5r4F6HNG,"{'created_at': {'value': '1646809856000', 'matchLevel': 'none', 'matchedWords': []}, 'updated_at': {'value': '1646810013000', 'matchLevel': 'none', 'matchedWords': []}, 'title': {'value': 'Search for Armed Person in Stolen Vehicle', 'matchLevel': 'none', 'matchedWords': []}, 'address': {'value': 'N Lake Shore Dr & E Erie St, Chicago, Illinois, 60611', 'matchLevel': 'none', 'matchedWords': []}, 'city_code': {'value': 'us-il-chicago', 'matchLevel': 'none', 'matchedWords': []}, 'location': {'value': 'N Lake Shore Dr & E Erie St', 'matchLevel': 'none', 'matchedWords': []}, 'neighborhood': {'value': 'River North, Chicago', 'matchLevel': 'none', 'matchedWords': []}, 'categories': [{'value': '<em>Weapon</em>', 'matchLevel': 'full', 'fullyHighlighted': True, 'matchedWords': ['weapon']}], 'ranking.level': {'value': '1', 'matchLevel': 'none', 'matchedWords': []}, 'ranking.views': {'value': '0', 'matchLevel': 'none', 'matchedWords': []}, 'ranking.notifications': {'value': '0', 'matchLevel': 'none', 'matchedWords': []}, 'severity': {'value': 'yellow', 'matchLevel': 'none', 'matchedWords': []}, '_geoloc': [{'lat': {'value': '41.89427003352637', 'matchLevel': 'none', 'matchedWords': []}, 'lng': {'value': '-87.61535990406543', 'matchLevel': 'none', 'matchedWords': []}}], 'updates': [{'created_at': {'value': '1646809855999', 'matchLevel': 'none', 'matchedWords': []}, 'text': {'value': 'Incident reported at N Lake Shore Dr & E Erie St.', 'matchLevel': 'none', 'matchedWords': []}}, {'created_at': {'value': '1646809856000', 'matchLevel': 'none', 'matchedWords': []}, 'text': {'value': 'Police are searching for a person who may be armed inside a vehicle who was last seen south along North Lake Shore Drive.', 'matchLevel': 'none', 'matchedWords': []}}, {'created_at': {'value': '1646809877000', 'matchLevel': 'none', 'matchedWords': []}, 'text': {'value': 'Police updated that this person may be the same one wanted for an armed robbery.', 'matchLevel': 'none', 'matchedWords': []}}, {'created_at': {'value': '1646810012000', 'matchLevel': 'none', 'matchedWords': []}, 'text': {'value': 'Police updated that the person is inside a white Nissan with license plate AM63468 which was stolen during a crajacking.', 'matchLevel': 'none', 'matchedWords': []}}]}"
117,1646809716000,1646809716000,Report of Duo Armed With Needles,"5733 S Kedzie Ave, Chicago, Illinois, 60629",us-il-chicago,5733 S Kedzie Ave,Chicago,['Weapon'],1,False,0,0,yellow,"[{'lat': 41.78860202049304, 'lng': -87.70316897318845}]","[{'created_at': 1646809715999, 'text': 'Incident reported at 5733 S Kedzie Ave.'}, {'created_at': 1646809716000, 'text': ""Police have received an unconfirmed report of a man and a woman armed with needles threatening people at a McDonald's drive-through.""}]",-MxhVWMOCS2WgupNDl6_,"{'created_at': {'value': '1646809716000', 'matchLevel': 'none', 'matchedWords': []}, 'updated_at': {'value': '1646809716000', 'matchLevel': 'none', 'matchedWords': []}, 'title': {'value': 'Report of Duo Armed With Needles', 'matchLevel': 'none', 'matchedWords': []}, 'address': {'value': '5733 S Kedzie Ave, Chicago, Illinois, 60629', 'matchLevel': 'none', 'matchedWords': []}, 'city_code': {'value': 'us-il-chicago', 'matchLevel': 'none', 'matchedWords': []}, 'location': {'value': '5733 S Kedzie Ave', 'matchLevel': 'none', 'matchedWords': []}, 'neighborhood': {'value': 'Chicago', 'matchLevel': 'none', 'matchedWords': []}, 'categories': [{'value': '<em>Weapon</em>', 'matchLevel': 'full', 'fullyHighlighted': True, 'matchedWords': ['weapon']}], 'ranking.level': {'value': '1', 'matchLevel': 'none', 'matchedWords': []}, 'ranking.views': {'value': '0', 'matchLevel': 'none', 'matchedWords': []}, 'ranking.notifications': {'value': '0', 'matchLevel': 'none', 'matchedWords': []}, 'severity': {'value': 'yellow', 'matchLevel': 'none', 'matchedWords': []}, '_geoloc': [{'lat': {'value': '41.78860202049304', 'matchLevel': 'none', 'matchedWords': []}, 'lng': {'value': '-87.70316897318845', 'matchLevel': 'none', 'matchedWords': []}}], 'updates': [{'created_at': {'value': '1646809715999', 'matchLevel': 'none', 'matchedWords': []}, 'text': {'value': 'Incident reported at 5733 S Kedzie Ave.', 'matchLevel': 'none', 'matchedWords': []}}, {'created_at': {'value': '1646809716000', 'matchLevel': 'none', 'matchedWords': []}, 'text': {'value': ""Police have received an unconfirmed report of a man and a woman armed with needles threatening people at a McDonald's drive-through."", 'matchLevel': 'none', 'matchedWords': []}}]}"
118,1646806532000,1646806679000,Report of Man With Knife Involved in Dispute,"4916 W Augusta Blvd, Chicago, Illinois, 60651",us-il-chicago,4916 W Augusta Blvd,Chicago,['Weapon'],1,False,0,0,yellow,"[{'lat': 41.89893900505217, 'lng': -87.74909803073345}]","[{'created_at': 1646806531999, 'text': 'Incident reported at 4916 W Augusta Blvd.'}, {'created_at': 1646806532000, 'text': 'Police have received an unconfirmed report of a man armed with a knife arguing with another person.'}]",-MxhJN4IsgG_FSgDwx2V,"{'created_at': {'value': '1646806532000', 'matchLevel': 'none', 'matchedWords': []}, 'updated_at': {'value': '1646806679000', 'matchLevel': 'none', 'matchedWords': []}, 'title': {'value': 'Report of Man With Knife Involved in Dispute', 'matchLevel': 'none', 'matchedWords': []}, 'address': {'value': '4916 W Augusta Blvd, Chicago, Illinois, 60651', 'matchLevel': 'none', 'matchedWords': []}, 'city_code': {'value': 'us-il-chicago', 'matchLevel': 'none', 'matchedWords': []}, 'location': {'value': '4916 W Augusta Blvd', 'matchLevel': 'none', 'matchedWords': []}, 'neighborhood': {'value': 'Chicago', 'matchLevel': 'none', 'matchedWords': []}, 'categories': [{'value': '<em>Weapon</em>', 'matchLevel': 'full', 'fullyHighlighted': True, 'matchedWords': ['weapon']}], 'ranking.level': {'value': '1', 'matchLevel': 'none', 'matchedWords': []}, 'ranking.views': {'value': '0', 'matchLevel': 'none', 'matchedWords': []}, 'ranking.notifications': {'value': '0', 'matchLevel': 'none', 'matchedWords': []}, 'severity': {'value': 'yellow', 'matchLevel': 'none', 'matchedWords': []}, '_geoloc': [{'lat': {'value': '41.89893900505217', 'matchLevel': 'none', 'matchedWords': []}, 'lng': {'value': '-87.74909803073345', 'matchLevel': 'none', 'matchedWords': []}}], 'updates': [{'created_at': {'value': '1646806531999', 'matchLevel': 'none', 'matchedWords': []}, 'text': {'value': 'Incident reported at 4916 W Augusta Blvd.', 'matchLevel': 'none', 'matchedWords': []}}, {'created_at': {'value': '1646806532000', 'matchLevel': 'none', 'matchedWords': []}, 'text': {'value': 'Police have received an unconfirmed report of a man armed with a knife arguing with another person.', 'matchLevel': 'none', 'matchedWords': []}}]}"
119,1646806170000,1646806382000,Report of Dispute Involving Knife,"1264 S Saint Louis Ave, Chicago, Illinois, 60623",us-il-chicago,1264 S Saint Louis Ave,Chicago,['Weapon'],1,False,0,0,yellow,"[{'lat': 41.86444101941979, 'lng': -87.71324100332019}]","[{'created_at': 1646806169999, 'text': 'Incident reported at 1264 S Saint Louis Ave.'}, {'created_at': 1646806170000, 'text': 'Police have received an unconfirmed report of a man who assaulted a woman. The woman is reportedly armed with a knife and threatening the man.'}, {'created_at': 1646806354000, 'text': 'Officers on the scene advised that the man had fled the scene in a white sedan.'}]",-MxhHzbFv2zy-G5ehyef,"{'created_at': {'value': '1646806170000', 'matchLevel': 'none', 'matchedWords': []}, 'updated_at': {'value': '1646806382000', 'matchLevel': 'none', 'matchedWords': []}, 'title': {'value': 'Report of Dispute Involving Knife', 'matchLevel': 'none', 'matchedWords': []}, 'address': {'value': '1264 S Saint Louis Ave, Chicago, Illinois, 60623', 'matchLevel': 'none', 'matchedWords': []}, 'city_code': {'value': 'us-il-chicago', 'matchLevel': 'none', 'matchedWords': []}, 'location': {'value': '1264 S Saint Louis Ave', 'matchLevel': 'none', 'matchedWords': []}, 'neighborhood': {'value': 'Chicago', 'matchLevel': 'none', 'matchedWords': []}, 'categories': [{'value': '<em>Weapon</em>', 'matchLevel': 'full', 'fullyHighlighted': True, 'matchedWords': ['weapon']}], 'ranking.level': {'value': '1', 'matchLevel': 'none', 'matchedWords': []}, 'ranking.views': {'value': '0', 'matchLevel': 'none', 'matchedWords': []}, 'ranking.notifications': {'value': '0', 'matchLevel': 'none', 'matchedWords': []}, 'severity': {'value': 'yellow', 'matchLevel': 'none', 'matchedWords': []}, '_geoloc': [{'lat': {'value': '41.86444101941979', 'matchLevel': 'none', 'matchedWords': []}, 'lng': {'value': '-87.71324100332019', 'matchLevel': 'none', 'matchedWords': []}}], 'updates': [{'created_at': {'value': '1646806169999', 'matchLevel': 'none', 'matchedWords': []}, 'text': {'value': 'Incident reported at 1264 S Saint Louis Ave.', 'matchLevel': 'none', 'matchedWords': []}}, {'created_at': {'value': '1646806170000', 'matchLevel': 'none', 'matchedWords': []}, 'text': {'value': 'Police have received an unconfirmed report of a man who assaulted a woman. The woman is reportedly armed with a knife and threatening the man.', 'matchLevel': 'none', 'matchedWords': []}}, {'created_at': {'value': '1646806354000', 'matchLevel': 'none', 'matchedWords': []}, 'text': {'value': 'Officers on the scene advised that the man had fled the scene in a white sedan.', 'matchLevel': 'none', 'matchedWords': []}}]}"
120,1646803261000,1646803261000,Report of Man Armed With Knife,"753 S California Ave, Chicago, Illinois, 60612",us-il-chicago,753 S California Ave,Chicago,['Weapon'],1,False,0,0,yellow,"[{'lat': 41.8713459893462, 'lng': -87.69568996862307}]","[{'created_at': 1646803260999, 'text': 'Incident reported at 753 S California Ave.'}, {'created_at': 1646803261000, 'text': 'Police have received an unconfirmed report of a man armed with a knife.'}]",-Mxh6tcGElFE12bB-c2w,"{'created_at': {'value': '1646803261000', 'matchLevel': 'none', 'matchedWords': []}, 'updated_at': {'value': '1646803261000', 'matchLevel': 'none', 'matchedWords': []}, 'title': {'value': 'Report of Man Armed With Knife', 'matchLevel': 'none', 'matchedWords': []}, 'address': {'value': '753 S California Ave, Chicago, Illinois, 60612', 'matchLevel': 'none', 'matchedWords': []}, 'city_code': {'value': 'us-il-chicago', 'matchLevel': 'none', 'matchedWords': []}, 'location': {'value': '753 S California Ave', 'matchLevel': 'none', 'matchedWords': []}, 'neighborhood': {'value': 'Chicago', 'matchLevel': 'none', 'matchedWords': []}, 'categories': [{'value': '<em>Weapon</em>', 'matchLevel': 'full', 'fullyHighlighted': True, 'matchedWords': ['weapon']}], 'ranking.level': {'value': '1', 'matchLevel': 'none', 'matchedWords': []}, 'ranking.views': {'value': '0', 'matchLevel': 'none', 'matchedWords': []}, 'ranking.notifications': {'value': '0', 'matchLevel': 'none', 'matchedWords': []}, 'severity': {'value': 'yellow', 'matchLevel': 'none', 'matchedWords': []}, '_geoloc': [{'lat': {'value': '41.87134598934620', 'matchLevel': 'none', 'matchedWords': []}, 'lng': {'value': '-87.69568996862307', 'matchLevel': 'none', 'matchedWords': []}}], 'updates': [{'created_at': {'value': '1646803260999', 'matchLevel': 'none', 'matchedWords': []}, 'text': {'value': 'Incident reported at 753 S California Ave.', 'matchLevel': 'none', 'matchedWords': []}}, {'created_at': {'value': '1646803261000', 'matchLevel': 'none', 'matchedWords': []}, 'text': {'value': 'Police have received an unconfirmed report of a man armed with a knife.', 'matchLevel': 'none', 'matchedWords': []}}]}"
121,1646798120000,1646798434000,Report of Person Armed With Knife,"15 W 69th St, Chicago, IL, 60621, USA",us-il-chicago,69th Station (Red Line),Chicago,['Weapon'],1,False,0,0,yellow,"[{'lat': 41.7683757009756, 'lng': -87.6258150876253}]","[{'created_at': 1646798119999, 'text': 'Incident reported at 69th Station (Red Line).'}, {'created_at': 1646798120000, 'text': 'Police have received an unconfirmed report of a person armed with a knife.'}]",-MxgoIBMg3cBEfd5l6Vr,"{'created_at': {'value': '1646798120000', 'matchLevel': 'none', 'matchedWords': []}, 'updated_at': {'value': '1646798434000', 'matchLevel': 'none', 'matchedWords': []}, 'title': {'value': 'Report of Person Armed With Knife', 'matchLevel': 'none', 'matchedWords': []}, 'address': {'value': '15 W 69th St, Chicago, IL, 60621, USA', 'matchLevel': 'none', 'matchedWords': []}, 'city_code': {'value': 'us-il-chicago', 'matchLevel': 'none', 'matchedWords': []}, 'location': {'value': '69th Station (Red Line)', 'matchLevel': 'none', 'matchedWords': []}, 'neighborhood': {'value': 'Chicago', 'matchLevel': 'none', 'matchedWords': []}, 'categories': [{'value': '<em>Weapon</em>', 'matchLevel': 'full', 'fullyHighlighted': True, 'matchedWords': ['weapon']}], 'ranking.level': {'value': '1', 'matchLevel': 'none', 'matchedWords': []}, 'ranking.views': {'value': '0', 'matchLevel': 'none', 'matchedWords': []}, 'ranking.notifications': {'value': '0', 'matchLevel': 'none', 'matchedWords': []}, 'severity': {'value': 'yellow', 'matchLevel': 'none', 'matchedWords': []}, '_geoloc': [{'lat': {'value': '41.7683757009756', 'matchLevel': 'none', 'matchedWords': []}, 'lng': {'value': '-87.6258150876253', 'matchLevel': 'none', 'matchedWords': []}}], 'updates': [{'created_at': {'value': '1646798119999', 'matchLevel': 'none', 'matchedWords': []}, 'text': {'value': 'Incident reported at 69th Station (Red Line).', 'matchLevel': 'none', 'matchedWords': []}}, {'created_at': {'value': '1646798120000', 'matchLevel': 'none', 'matchedWords': []}, 'text': {'value': 'Police have received an unconfirmed report of a person armed with a knife.', 'matchLevel': 'none', 'matchedWords': []}}]}"
122,1646794912000,1646794913000,Report of Woman Armed With Knife,"148 N Leamington Ave, Chicago, Illinois, 60644",us-il-chicago,148 N Leamington Ave,Chicago,['Weapon'],1,False,0,0,yellow,"[{'lat': 41.88319401903226, 'lng': -87.75422901276231}]","[{'created_at': 1646794911999, 'text': 'Incident reported at 148 N Leamington Ave.'}, {'created_at': 1646794912000, 'text': 'Police have received an unconfirmed report of a woman armed with a knife making threats.'}]",-Mxgc2QBAFOw18FLrFm1,"{'created_at': {'value': '1646794912000', 'matchLevel': 'none', 'matchedWords': []}, 'updated_at': {'value': '1646794913000', 'matchLevel': 'none', 'matchedWords': []}, 'title': {'value': 'Report of Woman Armed With Knife', 'matchLevel': 'none', 'matchedWords': []}, 'address': {'value': '148 N Leamington Ave, Chicago, Illinois, 60644', 'matchLevel': 'none', 'matchedWords': []}, 'city_code': {'value': 'us-il-chicago', 'matchLevel': 'none', 'matchedWords': []}, 'location': {'value': '148 N Leamington Ave', 'matchLevel': 'none', 'matchedWords': []}, 'neighborhood': {'value': 'Chicago', 'matchLevel': 'none', 'matchedWords': []}, 'categories': [{'value': '<em>Weapon</em>', 'matchLevel': 'full', 'fullyHighlighted': True, 'matchedWords': ['weapon']}], 'ranking.level': {'value': '1', 'matchLevel': 'none', 'matchedWords': []}, 'ranking.views': {'value': '0', 'matchLevel': 'none', 'matchedWords': []}, 'ranking.notifications': {'value': '0', 'matchLevel': 'none', 'matchedWords': []}, 'severity': {'value': 'yellow', 'matchLevel': 'none', 'matchedWords': []}, '_geoloc': [{'lat': {'value': '41.88319401903226', 'matchLevel': 'none', 'matchedWords': []}, 'lng': {'value': '-87.75422901276231', 'matchLevel': 'none', 'matchedWords': []}}], 'updates': [{'created_at': {'value': '1646794911999', 'matchLevel': 'none', 'matchedWords': []}, 'text': {'value': 'Incident reported at 148 N Leamington Ave.', 'matchLevel': 'none', 'matchedWords': []}}, {'created_at': {'value': '1646794912000', 'matchLevel': 'none', 'matchedWords': []}, 'text': {'value': 'Police have received an unconfirmed report of a woman armed with a knife making threats.', 'matchLevel': 'none', 'matchedWords': []}}]}"
123,1646788896000,1646788895000,Report of Man Stabbed,"6725 S Ada St, Chicago, Illinois, 60636",us-il-chicago,6725 S Ada St,Chicago,['Weapon'],1,False,0,0,yellow,"[{'lat': 41.77155800711901, 'lng': -87.65767401440893}]","[{'created_at': 1646788896000, 'text': 'Police have received an unconfirmed report of a man stabbed.'}, {'created_at': 1646788895999, 'text': 'Incident reported at 6725 S Ada St.'}]",-MxgG59CBeCAm4fiXTMR,"{'created_at': {'value': '1646788896000', 'matchLevel': 'none', 'matchedWords': []}, 'updated_at': {'value': '1646788895000', 'matchLevel': 'none', 'matchedWords': []}, 'title': {'value': 'Report of Man Stabbed', 'matchLevel': 'none', 'matchedWords': []}, 'address': {'value': '6725 S Ada St, Chicago, Illinois, 60636', 'matchLevel': 'none', 'matchedWords': []}, 'city_code': {'value': 'us-il-chicago', 'matchLevel': 'none', 'matchedWords': []}, 'location': {'value': '6725 S Ada St', 'matchLevel': 'none', 'matchedWords': []}, 'neighborhood': {'value': 'Chicago', 'matchLevel': 'none', 'matchedWords': []}, 'categories': [{'value': '<em>Weapon</em>', 'matchLevel': 'full', 'fullyHighlighted': True, 'matchedWords': ['weapon']}], 'ranking.level': {'value': '1', 'matchLevel': 'none', 'matchedWords': []}, 'ranking.views': {'value': '0', 'matchLevel': 'none', 'matchedWords': []}, 'ranking.notifications': {'value': '0', 'matchLevel': 'none', 'matchedWords': []}, 'severity': {'value': 'yellow', 'matchLevel': 'none', 'matchedWords': []}, '_geoloc': [{'lat': {'value': '41.77155800711901', 'matchLevel': 'none', 'matchedWords': []}, 'lng': {'value': '-87.65767401440893', 'matchLevel': 'none', 'matchedWords': []}}], 'updates': [{'created_at': {'value': '1646788896000', 'matchLevel': 'none', 'matchedWords': []}, 'text': {'value': 'Police have received an unconfirmed report of a man stabbed.', 'matchLevel': 'none', 'matchedWords': []}}, {'created_at': {'value': '1646788895999', 'matchLevel': 'none', 'matchedWords': []}, 'text': {'value': 'Incident reported at 6725 S Ada St.', 'matchLevel': 'none', 'matchedWords': []}}]}"
124,1646783486000,1646783826000,Report of Person Armed With Knife,"7037 S East End Ave, Chicago, Illinois, 60649",us-il-chicago,7037 S East End Ave,Chicago,['Weapon'],1,False,0,0,yellow,"[{'lat': 41.76682001062056, 'lng': -87.58250502291253}]","[{'created_at': 1646783486000, 'text': 'Police have received an unconfirmed report of a person armed with a knife.'}, {'created_at': 1646783485999, 'text': 'Incident reported at 7037 S East End Ave.'}]",-MxfwSU-rgJwVAx1Astp,"{'created_at': {'value': '1646783486000', 'matchLevel': 'none', 'matchedWords': []}, 'updated_at': {'value': '1646783826000', 'matchLevel': 'none', 'matchedWords': []}, 'title': {'value': 'Report of Person Armed With Knife', 'matchLevel': 'none', 'matchedWords': []}, 'address': {'value': '7037 S East End Ave, Chicago, Illinois, 60649', 'matchLevel': 'none', 'matchedWords': []}, 'city_code': {'value': 'us-il-chicago', 'matchLevel': 'none', 'matchedWords': []}, 'location': {'value': '7037 S East End Ave', 'matchLevel': 'none', 'matchedWords': []}, 'neighborhood': {'value': 'Chicago', 'matchLevel': 'none', 'matchedWords': []}, 'categories': [{'value': '<em>Weapon</em>', 'matchLevel': 'full', 'fullyHighlighted': True, 'matchedWords': ['weapon']}], 'ranking.level': {'value': '1', 'matchLevel': 'none', 'matchedWords': []}, 'ranking.views': {'value': '0', 'matchLevel': 'none', 'matchedWords': []}, 'ranking.notifications': {'value': '0', 'matchLevel': 'none', 'matchedWords': []}, 'severity': {'value': 'yellow', 'matchLevel': 'none', 'matchedWords': []}, '_geoloc': [{'lat': {'value': '41.76682001062056', 'matchLevel': 'none', 'matchedWords': []}, 'lng': {'value': '-87.58250502291253', 'matchLevel': 'none', 'matchedWords': []}}], 'updates': [{'created_at': {'value': '1646783486000', 'matchLevel': 'none', 'matchedWords': []}, 'text': {'value': 'Police have received an unconfirmed report of a person armed with a knife.', 'matchLevel': 'none', 'matchedWords': []}}, {'created_at': {'value': '1646783485999', 'matchLevel': 'none', 'matchedWords': []}, 'text': {'value': 'Incident reported at 7037 S East End Ave.', 'matchLevel': 'none', 'matchedWords': []}}]}"
